,Title,Content
39,Enhance Effectiveness,"['Enhance Effectiveness', '125.The Government actively promotes the Modular Integrated Construction (MiC) method. Intake for the first batch of pilot projects, including the InnoCell of the Hong Kong Science Park and the Disciplined Services Quarters for the Fire Services Department at Pak Shing Kok, is expected to commence early this year. Up to now, the Construction Innovation and Technology Fund has granted over $75 million to the industry for supporting their adoption of this method and the Buildings Department has approved 31 pre-accepted MiC systems to facilitate their adoption by the private building developers. ']"
40,Digitalisation of Public Works,"['Digitalisationof Public Works', '126.With $100 million allocated for the development of the integrated digital platform in the last Budget, the platform will be implemented in phases from this year onwards for driving digitalisation of public works through data integration and analysis to monitor project performance continuously and enhance the management of capital works projects. ']"
41,"Building a Liveable City, Land Supply","['Building aLiveable City', 'Optimise LandUse', 'Land Supply', ""127.The 2021-22 Land Sale Programme comprises a total of 15 residential sites and three commercial sites, capable of providing about 6 000 residential units and about 480 000 square metres of commercial floor area respectively. With the residential sites under the Land Sale Programme, together with railway property development projects, private development and redevelopment projects and the Urban Renewal Authority's projects, the potential land supply for the whole year is expected to have a capacity of providing about 16 500 units. The Secretary for Development will later announce the details of the Land Sale Programme for the next financial year."", '128.The construction of Kwu Tung North/Fanling North new development areas (NDAs) is making good progress. The intake for the first batch of public housing in Kwu Tung North is expected to take place in 2026, one year earlier than originally planned. Private residential sites in the area will be tendered gradually. The 12 hectares of private land involved in the first phase of the works for Hung Shui Kiu/Ha Tsuen NDA has been resumed as scheduled. Site formation and infrastructure works are underway. As for the Yuen Long South development, we are going through the statutory planning process. The first batch of public housing units will be completed in 2028. We will seek funding approval from the LegCo for studies related to the New Territories North NDA within this legislative session. The studies will commence shortly afterwards. ', '129.The first two parcels of housing land under the Tung Chung East reclamation works were handed over to the Hong Kong Housing Authority for public housing development last year. The first intake for about 10 000 public housing units will take place in 2024. ', '130.We estimate that in the NDA projects and other government and private development projects under planning, there is a total of over 860 hectares of brownfield sites in the New Territories which can gradually be redeveloped for housing and other land uses.', '131.Over the past few years, we have identified 210 sites with potential for housing development. Rezoning has been completed or commenced for 70 per cent of them. It is estimated that about 40 per cent of the public housing units to be completed in the next ten years will come from the rezoned sites. ', '132.We are examining the feasibility of rezoning five commercial sites in Kowloon East for residential use taking into account the latest economic situation and market response. If confirmed feasible, we plan to initiate the relevant statutory town planning procedure this year. A total of about 5 800 private housing units can be provided according to our preliminary estimation. ', '133.The Mass Transit Railway Corporation Limited and government departments are pressing ahead with the development of the Siu Ho Wan Depot Site. Our target is to have the first batch of about 6 000 public and private housing units gradually ready for intake in around 2030. Upon completion of the whole project, about 20 000 units will be provided, about half of which will be public housing units. ', '134.We plan to conduct later this year district consultations on two ""single site, multiple use"" projects, namely the redevelopment of Tuen Mun Clinic and the joint-user building for community facilities at Shan Mei Street in Shatin. Besides, we will apply funding from the LegCo as soon as possible for three other projects, namely one at the former Anderson Road Quarry site, one in Tseung Kwan O town centre and the other one near Sheung Wan Fire Station. In addition, we are reviewing about 40 ""Government, Institution or Community"" sites with joint use potential. We hope to put forward concrete proposals for these sites this year, including developing multi-purpose public facility buildings.', '135.The DEVB has set up the Development Projects Facilitation Office to facilitate the processing of planning, lease modification and building plan applications, etc. for private residential development projects with a yield of 500 flats or more by enhancing co-ordination among the departments involved. ', '136.The DEVB and the Lands Department will introduce a pilot scheme for charging land premium at ""standard rates"" in this quarter to encourage redevelopment of industrial buildings. ']"
42,Housing Supply,"['Housing Supply', ""137.We have identified land for the provision of 316 000 public housing units in the coming ten years. With the redevelopment of Hong Kong Housing Authority's factory estates, the number of public housing units may see further increase. It is estimated that the total public housing production in the five-year period from 2020-21 is about 101 400 units, comprising over 70 000 public rental housing and Green Form Subsidised Home Ownership Scheme units and over 30 000 other subsidised sale units. On private housing, it is estimated that the completion of private residential units will average over 18 000 units annually in the five years from 2021, representing an increase of about five per cent over the annual average of the past five years."", '138.The Government has already identified land for the provision of about 14 000 transitional housing units by end-2023. Intake of residents for over 1 100 units has taken place. Projects involving about 9 800 units have been launched. The $5 billion Funding Scheme to Support Transitional Housing Projects has approved projects involving over $2.6 billion, and the Government will inject another $3.3 billion this year. The Government is also seeking funding from the Community Care Fund to subsidise NGOs, as a pilot scheme, to rent suitable rooms in hotels and guesthouses with relatively low occupancy rates for use as transitional housing.']"
43,Green City,"['Green City', ""139.The Government strives to achieve carbon neutrality before 2050, and will update Hong Kong's Climate Action Plan in the middle of this year to set out more proactive strategies and measures to reduce carbon emissions. We are setting an example by implementing the Green Energy Target to boost the overall energy performance of the Government by six per cent by 2024-25. Concurrently, the Government will continue to promote new energy transportation so as to further reduce roadside air pollution.""]"
44,Promote New Energy Transportation,"['Promote NewEnergy Transportation', '140.The Government has all along been promoting the replacement of conventional fuel-propelled private cars (PCs) with electric vehicles (EVs). Last year, one out of eight new PCs is EV. In the past ten years, the number of EVs increased from 184 to over 18 500, with the total number of electric private cars (e-PCs) accounting for 2.7 per cent of the total number of PCs in Hong Kong. The ""One-for-One Replacement"" Scheme provides a higher first registration tax (FRT) concession for owners who buy a new e- PC and scrap their eligible old PC, subject to a cap of $250,000. Since its launch, 90 per cent of the owners of first registered e-PCs have benefited from the Scheme. The FRT concession for general e-PCs is $97,500.', '141.The Government launched the $2 billion EV-charging at Home Subsidy Scheme in October last year. It is expected that about 60 000 parking spaces in existing private residential buildings will be provided with EV charging-enabling infrastructure under the scheme in three years. Since the introduction of the scheme, applications involving more than 50 000 parking spaces have been received.', '142.Last year, the Government allocated an additional funding of $800 million to the New Energy Transport Fund and expanded its funding scope to cover additional types of electric commercial vehicles. As at end-2020, the amount of subsidy granted under the Fund was $154 million, covering nearly 200 projects on electric and hybrid commercial vehicles as well as conventional buses and ferries. Moreover, the Government earmarked $80 million for green public light bus (PLB) operators to embark on a pilot scheme on electric PLBs from 2023. Meanwhile, the Government also earmarked $350 million to provide subsidies for ferry operators to conduct trials on electric ferries serving in- harbour routes of the Victoria Harbour from 2023.', ""143.The Environment Bureau will announce next month Hong Kong's first roadmap on the popularisation of EVs, setting out long-term policy objectives and plans on the use of EVs and their associated supporting facilities. The key measures include ceasing the new registration of fuel-propelled PCs in 2035 or earlier, expanding the EV charging network and promoting its marketisation, training of EV technical and maintenance practitioners, and formulating a Producer Responsibility Scheme for retired EV batteries. The Government will also take the lead to use more EVs. ""]"
45,Improve Air Quality,"['Improve AirQuality', '144.To further improve air quality, the Government has implemented an ex‑gratia payment scheme of $7.1 billion to phase out about 40 000 Euro IV diesel commercial vehicles by end-2027. The Government will finish updating the Clean Air Plan for Hong Kong by the middle of this year to set out long-term goals and devise measures to further improve air quality.']"
46,Relieve Traffic Congestion,"['Relieve TrafficCongestion', '145.The number of PCs has been on the rise. Traffic congestion has been aggravating. The FRT and the vehicle licence fee for PCs have not been adjusted since 2011 and 1991 respectively. I propose increasing the rate of each tax band for the FRT for PCs (including e-PCs) by 15 per cent and the vehicle licence fee by 30 per cent. The above-mentioned adjustments have been gazetted for taking effect today. Other types of vehicles are not affected. The maximum FRT concession for e-PCs under the ""One-for-One Replacement"" Scheme will be raised correspondingly to $287,500, while the FRT concession cap for general e-PCs will remain unchanged. The Transport Department will also continue the studies on ""Congestion Charging"" and the Electronic Road Pricing Pilot Scheme in Central with the aim of optimising the use of road space and relieving traffic congestion.']"
47,Decarbonise and Reduce Waste,"['Decarbonise andReduce Waste', '146.In addition to the resources earmarked in previous Budgets, I will set aside an extra $1 billion for more than 80 projects to install additional small-scale renewable energy systems at government buildings and infrastructure. I will also set aside $150 million to conduct energy audits and install energy-saving appliances, free of charge, for NGOs subvented by the Social Welfare Department. In addition, the Green Tech Fund, set up with an allocation of $200 million by the Government, has just closed the first round of applications. The result is expected to be announced in the middle of this year. All these measures can help Hong Kong advance towards its carbon neutrality target, and will also create jobs.', '147.The Government will inject an additional funding of $1 billion to the Recycling Fund and extend the application period to 2027 so as to render continuous support to the trade, particularly the SMEs, in enhancing its operational capabilities and efficiency as well as coping with the latest needs of both the local and non-local markets. It is expected that more than 1 000 businesses will benefit from the measure. ']"
48,Quality Living,"['Quality Living', '148.Apart from large-scale infrastructure projects, I also care about developing a quality city for our citizens, including enhancing the facilities in our highly popular country parks, hiking trails, recreational facilities and harbourfront facilities. I will allocate more resources to the relevant projects.']"
49,Improve Country Parks,"['Improve CountryParks', ""149.I will set aside $500 million to carry out enhancement works on facilities in some country parks, such as providing recreational elements like additional lookout points, treetop adventure and glamping sites, improving toilet facilities and barbeque and picnic sites, and revitalising some wartime relics by converting them into open museums so as to enrich visitors' experience and enjoyment at the countryside. The new facilities will adopt low‑carbon and green design that integrates with its natural surroundings. The needs of all age groups and people with or without physical disabilities will be catered for. The new facilities will be rolled out gradually in the coming two to three years for public enjoyment. Meanwhile, I have also earmarked $55 million for the Tourism Commission to work with the Agriculture, Fisheries and Conservation Department to take forward the second phase of the enhancement programme for ten popular hiking trails in country parks that have potential for tourism in the coming five years, with a view to enriching leisure experience of the public and visitors. ""]"
50,Upgrade Recreational Facilities,"['Upgrade RecreationalFacilities', ""150.The Government has launched a five-year plan to modify more than 170 public play spaces managed by the Leisure and Cultural Services Department (LCSD) across the territory since 2019 with a view to providing children's play equipment which incorporate more elements of fun, creativity and challenge. To cater for people's diverse needs for fitness equipment, the LCSD will install some novel outdoor fitness equipment as appropriate when constructing new parks or renovating existing ones, such as the Yat Ming Road Park in North District which is near completion and the Butterfly Beach Park in Tuen Mun."", '151.Football has long been one of the most popular sports. The Kai Tak Sports Park, scheduled for completion in 2023, will provide, among others, two main stadiums for hosting both international and local football matches. The Five-year Plan for Sports and Recreational Facilities also includes the construction or reconstruction of 12 football pitches, including the redevelopment of Yuen Long Stadium.', '152.I will earmark $318 million to implement a five-year plan for upgrading over 70 football pitches under the management of LCSD, including substantially increasing the number of 5-a-side football pitches meeting international standards, exploring the possibility of expanding the existing football pitches into standard 11-a-side turf pitches and expediting the replacement of artificial turf on football pitches. Relevant national sports associations and their affiliates, district football groups, schools and other organisations will have more up-to-standard football pitches to organise football training programmes and football matches in the future. The general public, in particular young people, will have more opportunities to play football regularly and develop their potential, thereby contributing to the long-term development of football in Hong Kong. ']"
51,Enhance Harbourfront,"['Enhance Harbourfront', '153.I have earlier earmarked a total of $6.5 billion for harbourfront enhancement. We have completed six kilometres of harbourfront promenades over the past three years or so for public enjoyment. The 20 kilometres-plus Victoria Harbourfront promenades have now become popular leisure spots. This year, we will seek funding from the LegCo for commencing the construction works of two major projects, namely the Boardwalk underneath the Island Eastern Corridor and the harbourfront park at Eastern Street North in Sai Ying Pun. An incremental approach will continue to be adopted so that the harbourfront sites can be opened as early as possible for public enjoyment.']"
52,Strengthen Healthcare System,"['StrengthenHealthcare System', 'Healthcare Facilities and Manpower', '154.The HA will press ahead with the implementation of the first 10-year Hospital Development Plan (HDP) and the planning of the second 10-year HDP. The HA will review the design of hospital projects under the two 10-year HDPs taking into account the experience in combating COVID-19 and incorporate required provisions for two to three general wards in each selected hospital, so that they can be readily converted into Tier-2 isolation wards when the need arises.', '155.To strengthen professional healthcare training, around $1.9 billion has been allocated to the University of Hong Kong, the Chinese University of Hong Kong and the Hong Kong Polytechnic University in the past two financial years for carrying out short-term renovation works and facility enhancement as well as studies and medium and long-term works projects to increase their teaching facilities. The Government will continue to work with the universities to upgrade and increase healthcare-related teaching facilities.', '156.Healthcare workers play a pivotal role in our fight against the epidemic. The last Budget earmarked funding to support the HA in providing sufficient manpower for the public healthcare system and easing the pressure on healthcare workers. The measures are being taken forward.', 'Primary Healthcare', '157.Following the commencement of service of the first District Health Centre (DHC) in Kwai Tsing District, I earmarked $650 million recurrent expenditure for setting up DHCs in six other districts last year. Two of them in Sham Shui Po and Wong Tai Sin target to commence operation within the coming two years. Last year, I also allocated about $600 million for setting up ""DHC Expresses"" in the remaining 11 districts which are expected to commence service progressively within this year.', 'Development of Chinese Medicine', '158.The Government will award the service deed for the Chinese Medicine Hospital in Tseung Kwan O in the middle of this year, and construction works are expected to be completed in 2025. Since last year, the Government has also allocated more resources to the 18 Chinese Medicine Clinics cum Training and Research Centres, with a view to continuously enhancing the remuneration package of and training for Chinese medicine practitioners. Moreover, the Government promotes the development of Chinese medicine in Hong Kong through a dedicated fund of $500 million.', 'MentalHealth Services', '159.The Government will provide additional recurrent funding of around $147 million to enhance child and adolescent psychiatric, community psychiatric and psychogeriatric services of the HA, and support the enhanced service of Kwai Chung Hospital upon its redevelopment. It was earlier announced that a sum of $300 million will be used for strengthening support for people in need in the community as well as enhancing public awareness of the importance of mental health.']"
53,Caring and Inclusion,"['Caring andInclusion', '160.The Government will provide an extra 1500 subsidised elderly home care service places this year, involving an annual expenditure of about $150 million. The Government is also taking forward 66 new projects, providing about 8 800 residential care places and about 2 800 subsidised day care service places for the elderly in the coming few years. ', '161.The Government has substantially increased the resources allocated to rehabilitation services in recent years. The number of places for on-site pre-school rehabilitation services has been increased by 1 000 to 8 000 in the current school year and is expected to further increase to 10 000 in 2022/23 school year. ', '162.The Labour Department launched the Racial Diversity Employment Programme last year to enable NGOs to provide one- stop employment services for ethnic minority job seekers through a case management approach. Over 500 ethnic minority job seekers are expected to participate in the first two years of the programme. ', '163.The revenue for the Lotteries Fund has dropped substantially due to the epidemic. I will make an injection of $1.1 billion to ensure that development projects in respect of much- needed social welfare services premises (particularly major facilities for elderly and rehabilitation services) can proceed as scheduled and that the feasibility studies and detailed design work for such projects will not be affected.']"
