,Title,Content
9,Digital Economy,"['Digital Economy', '39.Many traditional industries have accelerated the application of technology in their operations due to the epidemic. Examples include digital payment; smart self-service systems; and various online businesses, customer services and workflow management. For many people who stay at home during the epidemic, the use of online shopping services, video streaming platforms and online conference software has become their new mode of working, studying and entertainment. For various trades, it has now become a trend to speed up digital transformation in order to adapt to the new consumption modes and habits of the people. Only by making good use of information technology can enterprises seize the opportunities of development when the epidemic is over.', '40.In view of the above, we have launched the Distance Business Programme under the AEF to provide funding support for enterprises to adopt information technology solutions and cover the expenses for providing relevant training to their employees. The programme has received an overwhelming response since its launch in mid-2020, and a total funding of nearly $800 million has been granted. We have subsequently allocated an additional funding of $1 billion for the continuation of the programme and further enhancement.', '41.The challenges posed by the epidemic have also catalysed local I&T development. They not only incentivise businesses to conduct research and development (R&D) for products or innovative services but also provide enterprises with suitable contexts for application. The electronic wristbands used for home confinement and the touchless lift button system are some good examples. The Government will continue to support enterprises or manufacturers through, among others, the Public Sector Trial Scheme, the Technology Voucher Programme and the Re-industrialisation Funding Scheme in realising and commercialising their R&D outcomes, using technological services to improve their productivity or business processes, and setting up smart production lines in Hong Kong. This will enable them to better grasp the opportunities brought by the new economy.', ""42.I will allocate a total of $375 million to the Hong Kong Trade Development Council (TDC) in three years starting from 2021- 22 for developing virtual platforms to enhance its capability to organise online activities and to proceed with digitalisation. Moreover, the TDC will promote Hong Kong's strength in the development of the GBA and in healthcare products and services. It will also explore the use of its physical and online Business- to- Consumer platforms to assist young business starters in promoting their original products and gauging the preference of consumers. "", '43.In light of the epidemic, we have expedited our work in taking forward e-Government by providing more electronic services to make it easier for enterprises and individuals to submit applications, make payments, obtain licences and use government services. By mid-2022, unless there are legal or operational constraints, all government forms and licence applications can be submitted electronically. Besides, e‑payment options (including the Faster Payment System) will be available for making payments in respect of most government bills and licences starting from mid-2022.', '44.The ""iAM Smart"", a one-stop personalised digital service platform, was launched at the end of last year. The HKMA is currently working with the Office of the Government Chief Information Officer (OGCIO) to develop the business version of the ""iAM Smart"" digital authentication platform. It can be used to authenticate the identity of enterprises through an electronic channel. With the wide adoption of ""iAM Smart"" in various electronic government services, members of the public can choose to obtain their data kept by individual government departments via electronic means, and submit such data electronically when applying for services from financial institutions. In addition, the HKMA has earlier announced the development of ""Commercial Data Interchange"", which will allow commercial services operators to submit customers\' data to financial institutions under the instruction and consent of their corporate customers so as to assist them in the application for services.', ""45.To promote the LawTech development, I set aside funding in the 2019-20 Budget to support the development of an online dispute resolution and deal making platform by a non-governmental organisation (NGO). With an allocation of $100 million to the project, starting from this year, the platform will roll out negotiation, arbitration, mediation and online training services progressively and develop other services such as e-translation and smart contract in phases. This year, the Government will actively explore the development of the Hong Kong Legal Cloud, in order to sharpen Hong Kong's edge and raise our status in the provision of professional legal services.""]"
10,Issue Consumption Vouchers,"['Issue ConsumptionVouchers', '46.In view of the current special situation, the Government should make good use of the fiscal reserves to energise the market, stimulate the economy, and facilitate the speedy recovery of the consumption market and other economic segments in a timely manner. After careful consideration, I will issue electronic consumption vouchers in instalments with a total value of $5,000 to each eligible Hong Kong permanent resident and new arrival aged 18 or above, so as to encourage and boost local consumption. This measure, which involves a financial commitment of about $36 billion, is expected to benefit around 7.2 million people. The Government will identify suitable stored value facilities operators to help roll out the scheme, and will announce the details of the scheme as soon as possible.']"
11,Explore Markets,"['Explore Markets', '47.I will inject $1.5 billion into the Dedicated Fund on Branding, Upgrading and Domestic Sales, and substantially extend in phases its geographical coverage from 20 to 37 economies to include all those with which Hong Kong has entered into Investment Promotion and Protection Agreements (IPPAs). The funding ceiling for each enterprise will be increased from $4 million to $6 million, so as to support enterprises in exploring more diversified markets by fully utilising the better protection offered by the IPPAs.']"
12,Support Tourism,"['Support Tourism', '48.The epidemic has dealt a heavy blow to the local tourism industry, bringing it to a standstill. Apart from the financial support of nearly $2.6 billion that has already been provided for the tourism industry, I will further earmark a total of $934 million to enhance tourism resources, of which $169 million will be used to continue to take forward local cultural, heritage and creative tourism projects, such as the Yim Tin Tsai Arts Festival and the City in Time. We will continue to improve the facilities along hiking trails to develop more green tourism resources. The purpose is to offer leisure and travel experience with rich historical and cultural elements to both locals and visitors.', '49.I will also earmark $765 million to support the Hong Kong Tourism Board (HKTB) in reviving our tourism industry. The HKTB has launched promotional programmes such as ""Holiday at Home"" and ""360 Hong Kong Moments"" with a view to enhancing local ambience and consumption as well as maintaining the promotion and exposure of Hong Kong in visitor source markets. Upon gradual resumption of cross-boundary travel, the HKTB will roll out promotional offers to attract visitors through the ""Open House Hong Kong"" platform. The HKTB is also conducting a comprehensive review of the positioning of Hong Kong\'s tourism in the long run in response to the ""new normal"" after the epidemic with a view to formulating appropriate strategies to spur the recovery of the tourism industry.', '50.Provided that public health can be safeguarded, the Government will consider relaxing restrictions on group gatherings in relation to local group tours again to allow room for business operation for the tourism industry. The Government will discuss and work out arrangements regarding Air Travel Bubble with places that have close economic and trade relations with Hong Kong and where the epidemic situation is relatively stable.', ""51.Apart from the above initiatives, additional resources will also be allocated to enhance country parks, recreational facilities, harbourfront, etc. These enhancements will improve people's quality of life when the epidemic is over and may also appeal to our visitors. I will provide more details in the ensuing parts of my speech.""]"
13,Promote Hong Kong,"['Promote HongKong', '52.Once the pandemic further subsides, the Government will launch a large-scale publicity and promotional campaign at home and abroad, showcasing to the world the image of Hong Kong as a highly open international city in the GBA from various perspectives such as finance, I&T, culture and creativity and tourism, as well as our unique advantages under ""One Country, Two Systems"". We hope to attract enterprises, investors and talent to Hong Kong. InvestHK and our overseas offices will step up their efforts in this area.']"
14,"Positioning and Directions for Economic Development, Assessment of Situation ","['Stimulating theEconomy', 'Positioning andDirections for Economic Development', 'Assessment ofSituation', '53.Hong Kong has been leveraging the support from the Mainland while engaging the world. Over the past many years, we have been utilising our advantages in institution, talents and external connections, and served as a bridge between our country and the rest of the world in different ways in response to our country\'s ever-changing needs. By doing so, Hong Kong has contributed to national development and at the same time promoted its own development and economic growth. Only by making good use of the advantages of ""One Country, Two Systems"" with the precondition of strengthening national security can we continue to play and even enhance our role on this front.', '54.Over the past two years, Hong Kong has been affected by the deterioration of the China-US relations, and experienced the blow from the social incidents and the ravages of the pandemic. However, we should not let these challenges weaken our confidence in the future. Instead, we should learn from the experience and make correct assessment of the major development trends.', ""55.First, the world is facing profound changes unseen in a century. The economic gravity is shifting from West to East, and the political setting has also seen subtle changes. Our country's composite national strength has enhanced significantly, while other developing countries in Asia have undergone robust development. However, with the rise of unilateralism in recent years and the misunderstandings of some western countries towards Hong Kong's developments, we are facing greater difficulties. The epidemic has increased various countries' concerns about development security, which might further escalate protectionism. Some nations encourage or even ask enterprises to move back to their home countries, impacting on the development and setting of global value chains."", ""56.Second, the world is facing drastic disruptions brought by technological revolution, which have far-reaching implications for our personal life, modes of production and operation, economic structures, development prospects and international landscape. The pandemic has also accelerated changes in the mode of business operation and people's living habits. Making good use of digital technology is not only essential to effective business operation, but also crucial for preventing and combating the pandemic and protecting public health and safety. Whether a place can attain a leading position in I&T will determine its success or failure. "", '57.Third, green development is a major global trend. Environmental pollution and climate change have become too serious to ignore. There is a general recognition in the international community that we should promote green and low-carbon development, which involves extensive new areas. The Government needs to have visions and determination; the people need to build awareness of environmental protection and corresponding habits; the business sector needs to develop and adopt novel technologies, and launch products of high efficiency. Other matching services such as financial support are also needed.', '58.Fourth, as for Hong Kong, we have experienced many changes at different points in our history, but the support of our country has remained unchanged. With the advantages under ""One Country, Two Systems"", Hong Kong has a unique and irreplaceable role in the national development.']"
15,Functions andPositioning,"['Functions andPositioning', ""59.With its deep and extensive connections with the world, Hong Kong will continue to be an important platform for economic exchanges and trade between the Mainland and the international community. As mentioned in the Proposal for Formulating the National 14th Five-Year Plan, our country supports Hong Kong in consolidating and bolstering our competitive edges, building the city as an international I&T hub, fostering the development of the city as a B&R functional platform, and achieving diversified and sustainable development of the economy. With our country's support, we can further capitalise on our advantages and realise our potential. We must step up our efforts to explore international economic and trade opportunities and actively participate in national development through making use of our industries with competitive strengths."", ""60.Hong Kong has prominent functional roles in various aspects such as pooling international capital and talent, and providing a platform to align our country's standards with the international ones. In addition, Hong Kong serves as a testing ground and firewall in our country's promotion of financial sector reform and opening up (such as the internationalisation of Renminbi (RMB)). Under our country's dual circulation development strategy, Hong Kong will definitely achieve greater success in the future as long as we can give full play to our unique roles as a gateway, a springboard and an intermediary."", ""61.Leveraging our close proximity, Hong Kong can make use of the GBA development as an entry point, participating actively in the development of our country's domestic circulation for capturing the enormous business opportunities. As an international metropolis that connects the world, Hong Kong can help the expansion of the country's external circulation, and in consequence further strengthen its status as an international centre for finance, commerce and trade, as well as a home for corporate headquarters."", ""62.In the face of rising unilateralism, it is all the more important for us to actively promote multilateralism, dismantle various barriers and strength Hong Kong's links with the international community. We should further expand Hong Kong's trade, investment and tax agreement networks. The Free Trade Agreement and the Investment Agreement between Hong Kong and the Association of Southeast Asian Nations have recently come into full effect. In November last year, our country signed the RCEP Agreement with 14 economies. We are actively seeking to be among the first batch of economies joining the RCEP after it comes into effect, so as to help Hong Kong businesses and investors open up markets, thereby fostering the long-term economic development of Hong Kong. ""]"
16,The Way Forwardfor Industries,"['The Way Forwardfor Industries', ""63.From the perspective of industries, Hong Kong has huge development potential in areas including financial services, I&T, green economy, air cargo, supply chain management and professional services. Financial services are an important support to the real economy. On top of being a leading asset and wealth management centre, Hong Kong is also an international fundraising platform, an insurance and risk management centre and an offshore RMB hub. Our financial services can assist Mainland enterprises in raising funds, and provide outlets and risk management for Mainland funds, as well as facilitating the Mainland's ongoing financial liberalisation in a secure and orderly manner in support of the development of our country's real economy. We must continue to strengthen Hong Kong's leading position in the global financial market."", ""64.Hong Kong enjoys a number of advantages in I&T development, such as top-notch capabilities in basic scientific research, intellectual property rights protection, attractiveness to research talents from all over the world and first‑class financial support services. In recent years, the Government has allocated substantial resources and implemented a number of preferential policies, and been blessed with our country's support. As long as we can leverage our advantages and achieve co‑ordinated development with our brother cities that have advanced manufacturing industries in the GBA, we can form an I&T upstream, midstream and downstream industrial chain and develop the GBA into an international I&T centre, thus contributing to our country's technological self‑reliance and at the same time identifying new areas of growth for Hong Kong's economy. "", '65.Nowadays, when everyone is striving to live a quality life, decarbonisation, waste reduction, building of a green environment and a sustainable city, etc. have become a social consensus. The international community, including our country and the European Union, have set achieving carbon neutrality as an important development goal. A significant synergy effect can be generated between green economy and other industries such as the I&T and financial sectors. Our robust green and sustainable financial services can contribute to the development of green economy in the Mainland and Hong Kong. ', ""66.Hong Kong is a world-class logistics and supply chain management centre. With a well‑established network of air routes, a highly efficient airport as well as simple and fast customs clearance procedures, Hong Kong's air cargo transport sector plays a leading role in the world. We will strive to enhance our intermodal transportation services in the future, with a view to increasing the global accessibility of the GBA. This will facilitate not only the exports of goods from the GBA to overseas markets, but also the imports of quality products from around the world to the Mainland, meeting the increasing consumer demands there. Technology is reshaping the interplay between the supply of goods and the demand of consumers, and the prospects for our high-end logistics and supply chain management services are bright."", ""67.As our country seeks to achieve high‑quality development, the demand for various types of professional services such as legal, accounting, construction and project management services is on the rise. These areas are where our strengths lie. Hong Kong's professionals can provide services in a market full of opportunities, and also promote the alignment of industry standards in the Mainland with those of the international community."", '68.Apart from the above industries, there is also a growing demand for inclusion of cultural and creative elements in the cyber world. I will allocate additional resources to promote the development of cultural and creative industries, so that young people can have more employment and business start-up opportunities for unleashing their potential and realising their dreams.']"
17,Guangdong-Hong Kong-Macao Greater Bay Area,"['Guangdong-HongKong-Macao Greater Bay Area', ""69.As mentioned earlier, the GBA is the best entry point for Hong Kong to participate in the domestic circulation of our country's economy. Be it for the mutual market access for financial services and products, cooperation and collaboration in respect of innovation and technology, or people's stay and living across the boundary, continued innovation in institutional and policy arrangement is needed so as to ensure a smoother two-way flow of funds, people and factors of production. The Guangdong-Hong Kong-Macao Greater Bay Area Development Office has been set up to strengthen the planning, coordination and promotion of the various policies and measures relating to GBA development, and enhance the community's understanding of GBA development. The Government also helps Hong Kong's businesses and youths to grasp the opportunities arising from GBA development through various schemes.""]"
18,Belt and Road,"['Belt and Road', ""70.Our country has signed cooperation agreements with about 170 countries and international organisations regarding the B&R initiative. The Government will continue to provide financing services to B&R infrastructure projects through leveraging Hong Kong's function as an international financial centre, encourage Hong Kong enterprises and professional services sectors to develop business in the overseas Economic and Trade Co-operation Zones set up by our country, and establish connections with Mainland enterprises and industry associations for jointly exploring new markets, thereby consolidating Hong Kong's role as a prime functional platform and key node for the B&R Initiative.""]"
19,Financial Services,"['FinancialServices', '71.Comprehensive and superb financial services are crucial for an economy gearing for high-quality development. The value added of the financial services industry in Hong Kong accounted for 21 per cent of the GDP in 2019. Its share of the overall employment increased from 6.8 per cent in 2018 to 7.1 per cent in 2019. Hong Kong has always been an offshore financing centre for Mainland enterprises and an important conduit for international capital to enter the Mainland market. The capital markets of Hong Kong and the Mainland can complement and interact positively with each other. ', '72.Last year\'s total transaction value of the Southbound and Northbound Trading of Stock Connect programmes more than doubled that of the year before. The mutual market access programmes have been operating smoothly. Hong Kong can contribute more proactively to our country\'s ""dual circulation"" strategy. The FSTB, together with the HKMA, the Securities and Futures Commission (SFC) and the Insurance Authority (IA), has set up a joint working group to explore how Hong Kong can complement the economic and financial development of our country and meet the needs of international investors, and examine how to further enhance Hong Kong\'s competitiveness as an international financial centre on the basis of our existing capacities. It will set out the development blueprint and put forward concrete proposals and measures for engagement with the Central Authorities to secure their support.']"
20,Green and Sustainable Finance,"['Green andSustainable Finance', ""73.Having regard to the goal of achieving carbon neutrality before 2050, we will continue to promote the development of green and sustainable finance, encourage institutions to conduct relevant investment, financing and certification activities and attract top- notch institutions and talent to Hong Kong to provide the relevant services. We will join hands with the financial sector and relevant stakeholders to take forward the strategic plan announced end last year by the Green and Sustainable Finance Cross‑Agency Steering Group, thereby leveraging our role as an international financial centre to mobilise capital towards sustainable projects in the region and enhance Hong Kong's position as a green and sustainable finance hub in the region."", '74.Last month, we successfully offered the second batch of government green bonds totalling US$2.5 billion, among which the 30-year tranche is the longest-tenor bond issued by the Government and the longest-tenor USD-denominated government bond in Asia to date. We plan to issue green bonds regularly and expand the scale of the Government Green Bond Programme. We propose to double the borrowing ceiling of the Programme to $200 billion to allow for further issuance of green bonds totalling $175.5 billion within the next five years, having regard to the market situation. This will also give us more room for piloting the issuance of green bonds that involves more types of currencies, project types and issuance channels, thereby further enriching the green finance ecosystem in Hong Kong. We also plan to issue retail green bonds for the participation of the general public. ', '75.The Pilot Bond Grant Scheme and the Green Bond Grant Scheme rolled out by the Government previously will expire by mid- 2021. We will consolidate the two schemes into a Green and Sustainable Finance Grant Scheme to provide subsidy for eligible bond issuers and loan borrowers to cover their expenses on bond issuance and external review services. The Scheme will last for three years and the HKMA will announce relevant details in due course.']"
